{
  "alert_id": "alert-fixture-001",
  "facility_id": "fac-latos-bridgend",
  "entity_id": "asset-latos-bridgend",
  "event_type": "constraint_warning",
  "detected_at": "2026-06-27T14:30:00Z",
  "severity": "warning",
  "mw_curtailed": null,
  "constraint_zone": "National Grid — South Wales",
  "telemetry_source": "stub",
  "register_ref": "TEC-FIXTURE-LATOS-001",
  "policy_linkage": {
    "policy_id": "POL-FIXTURE-PARAM-001",
    "broker_id": "miller",
    "trigger_eligible": true
  },
  "data_source": "fixture"
}
